{
  "company": {
    "id": null,
    "name": "Perplexity AI",
    "category": "AI Search",
    "description": null,
    "created_at": null,
    "thebrain_thought_id": "5d41557d-369a-4075-ad03-e83ebddb3605",
    "company_id": null,
    "industry": null,
    "founded_year": null,
    "headquarters": null,
    "website": null,
    "updated_at": null,
    "urls": []
  },
  "stats": {
    "monitored_urls": "0",
    "total_changes": "1",
    "high_interest_changes": "1",
    "changes_last_week": "1",
    "avg_interest_level": "8.0000000000000000"
  },
  "changes": [
    {
      "id": 124,
      "url_id": null,
      "change_type": "new",
      "summary": null,
      "old_content_id": null,
      "new_content_id": null,
      "relevance_score": null,
      "interest_level": 8,
      "interest_data": null,
      "detected_at": "2025-07-21T15:21:10.364Z",
      "company": "Perplexity AI",
      "url_name": "product",
      "old_hash": null,
      "new_hash": "17d44c7590ececeb9c8f765ee7fe97a0f2ef8e8624695016c55080d63fde3175",
      "ai_analysis": {
        "technical_innovation_score": 8,
        "business_impact_score": 7,
        "interest_level": 8,
        "interest_drivers": [
          "Unlimited Pro Search",
          "Upgraded AI models",
          "Image generation",
          "Custom knowledge hubs",
          "Collaborative spaces",
          "Access to advanced AI models like OpenAI o3-pro and Anthropic Claude 4 Opus"
        ],
        "category": "AI-powered Search and Productivity",
        "impact_areas": [
          "Search",
          "AI Models",
          "Productivity",
          "Collaboration"
        ],
        "summary": "Perplexity Pro offers advanced AI-powered search capabilities, upgraded AI models, and collaborative features, indicating significant technical innovation and business impact in the AI search and productivity space."
      },
      "url": null,
      "title": "Perplexity",
      "content_preview": "Title: Perplexity\n\nPerplexity Pro is the most powerful way to search the internet with unlimited Pro Search, upgraded AI models, unlimited file upload, image generation, custom knowledge hubs, and collaborative spaces.\nPro\nPopular\n$20.00\n/ month\n$16.67\nwhen billed annually\nUpgrade productivity and learning with additional access.\nGet Pro\n10x as many citations in answers\nAccess to Perplexity Labs\nUnlimited file and photo uploads\nExtended access to Perplexity Research\nExtended access to image generation\nOne subscription for all the latest AI models\nExclusive access to Pro Perks\nAnd much more\nExisting subscriber? See billing help\nMax\n$200.00\n/ month\nUnlock Perplexity's full capabilities with early access to new products.\nGet Max\nEverything in Pro\nEarly access to Comet, the agentic browser\nUnlimited access to Perplexity Labs\nUnlimited access to Perplexity Research\nUse advanced AI models like OpenAI o3-pro and Anthropic Claude 4 Opus\nPriority support\nFor personal use only, and subject to ou"
    },
    {
      "id": 124,
      "url_id": null,
      "change_type": "new",
      "summary": null,
      "old_content_id": null,
      "new_content_id": null,
      "relevance_score": null,
      "interest_level": 8,
      "interest_data": null,
      "detected_at": "2025-07-21T15:21:10.364Z",
      "company": "Perplexity AI",
      "url_name": "product",
      "old_hash": null,
      "new_hash": "17d44c7590ececeb9c8f765ee7fe97a0f2ef8e8624695016c55080d63fde3175",
      "ai_analysis": {
        "technical_innovation_score": 8,
        "business_impact_score": 7,
        "interest_level": 8,
        "interest_drivers": [
          "Unlimited Pro Search",
          "Upgraded AI models",
          "Image generation",
          "Custom knowledge hubs",
          "Collaborative spaces",
          "Access to advanced AI models like OpenAI o3-pro and Anthropic Claude 4 Opus"
        ],
        "category": "AI-powered Search and Productivity",
        "impact_areas": [
          "Search",
          "AI Models",
          "Productivity",
          "Collaboration"
        ],
        "summary": "Perplexity Pro offers advanced AI-powered search capabilities, upgraded AI models, and collaborative features, indicating significant technical innovation and business impact in the AI search and productivity space."
      },
      "url": null,
      "title": "Perplexity",
      "content_preview": "Title: Perplexity\n\nPerplexity Pro is the most powerful way to search the internet with unlimited Pro Search, upgraded AI models, unlimited file upload, image generation, custom knowledge hubs, and collaborative spaces.\nPro\nPopular\n$20.00\n/ month\n$16.67\nwhen billed annually\nUpgrade productivity and learning with additional access.\nGet Pro\n10x as many citations in answers\nAccess to Perplexity Labs\nUnlimited file and photo uploads\nExtended access to Perplexity Research\nExtended access to image generation\nOne subscription for all the latest AI models\nExclusive access to Pro Perks\nAnd much more\nExisting subscriber? See billing help\nMax\n$200.00\n/ month\nUnlock Perplexity's full capabilities with early access to new products.\nGet Max\nEverything in Pro\nEarly access to Comet, the agentic browser\nUnlimited access to Perplexity Labs\nUnlimited access to Perplexity Research\nUse advanced AI models like OpenAI o3-pro and Anthropic Claude 4 Opus\nPriority support\nFor personal use only, and subject to ou"
    }
  ],
  "insights": [],
  "entities": {
    "technologies": [],
    "products": []
  },
  "themes": [],
  "key_points": [],
  "last_updated": "2025-07-22T14:24:28.893Z"
}